{
  "id": "KSP-Realistic-Stage1",
  "total_stages": 1,
  "current_stage": 0,
  "mass": 30000,
  "altitude": 0.0,
  "velocity": 0.0,
  "stages": [
    {
      "stage": 0,
      "fuel": 20000,
      "thrust": 600000,
      "deltaV": 4000,
      "isp": 320
    }
  ],
  "notes": "KSP 1단 로켓 예시: mass=30t, thrust=600kN, fuel=20t, isp=320, TWR>2"
}